"We've seen over time that countries that have the best economic growth are those that have good governance, and good governance comes from freedom of communication. It comes from ending corruption. It comes from a populace that can go online and say, 'This politician is corrupt, this administrator, or this public official is corrupt.'",Freedom
Education is the key to unlock the golden door of freedom.,Freedom
Americans are so enamored of equality that they would rather be equal in slavery than unequal in freedom.,Freedom
A big part of financial freedom is having your heart and mind free from worry about the what-ifs of life.,Freedom
The essence of mathematics lies in its freedom.,Freedom
"To me, punk rock is the freedom to create, freedom to be successful, freedom to not be successful, freedom to be who you are. It's freedom.",Freedom
Everyone has his or her own opinion and I always welcome criticism. That's why we have freedom of expression and that's also what I stand for - but I won't stand for insults.,Freedom
"Anywhere, anytime ordinary people are given the chance to choose, the choice is the same: freedom, not tyranny; democracy, not dictatorship; the rule of law, not the rule of the secret police.",Freedom
I find only freedom in the realms of eccentricity.,Freedom
"The fight for freedom must go on until it is won; until our country is free and happy and peaceful as part of the community of man, we cannot rest.",Freedom
"All the great things are simple, and many can be expressed in a single word: freedom, justice, honor, duty, mercy, hope.",Freedom
A kite needs to be tied down in order to fly. I learned how important restrictions can sometimes be in order to experience freedom.,Freedom
"A man can be himself only so long as he is alone, and if he does not love solitude, he will not love freedom, for it is only when he is alone that he is really free.",Freedom
One of my great joys in life is being a pilot. There is a great sense of freedom in soaring through the sky. You get a different perspective up there. Seeing things that aren't so apparent from the ground.,Freedom
"There can be no democracy without truth. There can be no truth without controversy, there can be no change without freedom. Without freedom there can be no progress.",Freedom
Grace is the beauty of form under the influence of freedom.,Freedom
"Once people enjoy the taste of freedom, there is no turning back.",Freedom
"As soon as laws are necessary for men, they are no longer fit for freedom.",Freedom
"I believe in Liberty for all men: the space to stretch their arms and their souls, the right to breathe and the right to vote, the freedom to choose their friends, enjoy the sunshine, and ride on the railroads, uncursed by color; thinking, dreaming, working as they will in a kingdom of beauty and love.",Freedom
"Without freedom of thought, there can be no such thing as wisdom - and no such thing as public liberty without freedom of speech.",Freedom
The American flag is the most recognized symbol of freedom and democracy in the world.,Freedom
"My idea of freedom is that we should protect the rights of people to believe what their conscience dictates, but fight equally hard to protect people from having the beliefs of others imposed upon them.",Freedom
"Freedom of speech means freedom for those who you despise, and freedom to express the most despicable views. It also means that the government cannot pick and choose which expressions to authorize and which to prevent.",Freedom
"Factually, the Temple Mount is the precise location of the Temple. It's the holiest place in the world for Jews. It's the third holiest place for Muslims. And we need to respect each others' rights, freedom of religion.",Freedom
Too much freedom can lead to the soul's decay.,Freedom
The family is the test of freedom; because the family is the only thing that the free man makes for himself and by himself.,Freedom
Men who want to support women in our struggle for freedom and justice should understand that it is not terrifically important to us that they learn to cry; it is important to us that they stop the crimes of violence against us.,Freedom
"Our greatest happiness does not depend on the condition of life in which chance has placed us, but is always the result of a good conscience, good health, occupation, and freedom in all just pursuits.",Freedom
"There are 4 billion cell phones in use today. Many of them are in the hands of market vendors, rickshaw drivers, and others who've historically lacked access to education and opportunity. Information networks have become a great leveler, and we should use them together to help lift people out of poverty and give them a freedom from want.",Freedom
"Jews have been harmed by the threats to freedom of opinion and debate, the punishments for candor, and the decline in rigorous standards in the academy that have accompanied progressive hegemony, which insists upon the sacrosanct status of affirmative action and other policies favored by the left.",Freedom
Tech companies are famous for providing freedom for engineers to customize their environments & experiment with new tools... allowing for this freedom helps creativity and productivity.,Freedom
"Political prisoners are important to support because we are in prison for explicitly social/political/progressive goals. Our lack of freedom does affect how free you are; If we can be violated, so can you.",Freedom
"The liberals think government exists to fix what's wrong with America. They find fault with our Constitution, our economic model and our core values. We disagree with the premise of their argument. We believe there's nothing wrong with America that an extra dose of freedom won't cure.",Freedom
Perfect freedom is reserved for the man who lives by his own work and in that work does what he wants to do.,Freedom
The Bill of Rights was intended to secure freedom of speech - the freedom of speech of members of parliament to speak freely rather than be at threat of... the threat of an over powerful monarch at the time.,Freedom
"The world of extreme sports is also one of big business. Kids might think that snowboarding is the ultimate freedom, but this freedom is being marketed to them by commercial sponsors.",Freedom
"The United States did not keep its promise to help us fight for freedom and it was in the same fight that the United States lost 50,000 of its young men.",Freedom
"A lot of fighters want that freedom to have their own sponsorships. When you think about it, how do you make independent contractors wear a uniform? That just seems strange to me.",Freedom
"Freedom of speech, freedom of the press, and freedom of religion all have a double aspect - freedom of thought and freedom of action.",Freedom
Get in the race car do what I do then go home. We don't have freedom to do anything anymore.,Freedom
"I think female solitude is a mental condition as well as a physical state. You can be married and a spinster. I think spinster is an identity every woman can claim, if she will... I feel like a lot of women, or a lot of feminists, joke about taking to the sea or living alone in a cottage as this kind of fun freedom.",Freedom
"I'm not going to fearmonger to win an election. I'm going to focus on the positive opportunities we have for a bright future for all of our families, where everyone has the freedom and opportunity to thrive.",Freedom
"I initially decided to speak about my anorexia and bulimia, partly out of a selfish motivation. I felt I had been scrutinised for my weight and thought, 'At least judge and criticise me on the facts.' There was a freedom with that. Now it's out there, and I just get on with life. I'm at peace with things.",Freedom
"You can't look past the captain Eoin Morgan, as well as Trevor Bayliss and Paul Farbrace for giving guys the freedom to play without fear and not to worry about consequences.",Freedom
I hope my work has inspired young artists. I have always tried to maintain my freedom as an artist and I feel it is one of the main reasons I have been successful.,Freedom
"Freedom is neither guaranteed nor automatic; not even in the United States. Left unguarded, it can slip away like a thief in the night.",Freedom
"In the U.S., free speech and the press are protected by the First Amendment. It has a clarity unmatched by modern legislators and declares that 'Congress shall make no law... abridging the freedom of speech, or the press.'",Freedom
"There must be freedom for all to live, to think, to worship, no book, no avenue must be closed.",Freedom
"I often wonder if I had the complete freedom to not have to write, if I would write. That's the one mystery that I hope I get to experience.",Freedom
The genius of the American system is that through freedom we have created extraordinary results from plain old ordinary people.,Freedom
"Now I'm old... maybe I'm still an eccentric hippie. There's a wonderful freedom in the eccentricity - you can go places, you can be wacky, and you don't have to be constrained. I think that's why people are eccentric - eccentricity is a weapon... and it's great!",Freedom
Beauty of mind creates freedom. Freedom of mind creates beauty.,Freedom
"I joined the Labour party because I believed in equality, in freedom of speech and in tolerance, compassion and understanding for people, irrespective of their background and views. In whatever I decide to do in the future I will hold to those principles.",Freedom
"But please know, whether you believe campaign contributions are speech or property, that I learned to love very dearly the right of free expression when I lived without that freedom for a while a long time ago.",Freedom
"Our Founding Fathers knew that without Second Amendment freedom, all of our freedoms could be in jeopardy.",Freedom
"When historians consider the significance of the Berlin crises of the mid-20th century, I do not believe that they will record it as an incident in the encirclement of freedom. The true view, in my judgment, will be to see it rather as a major episode in the recession of communism.",Freedom
"One of the interesting things here is that the people who should be shaping the future are politicians. But the political framework itself is so dead and closed that people look to other sources, like artists, because art and music allow people a certain freedom.",Freedom
"We are a people of many different religions and many different faiths. The only way forward in a pluralistic society of diverse faiths such as ours is to have laws that protect and respect the freedom of all, equally.",Freedom
"Don't get me wrong, I am a proud Republican, and I want to support my party. I am a firm believer in the Republican principles of smaller government, low taxes and economic freedom. I have spent my time in government service fighting for these principles.",Freedom
I'm spoiled. All of my adult jobs have left me with complete freedom to come up with what I wanted.,Freedom
I like the freedom of podcasting. With podcasting you can really mess around with the form and the format. You can do as much time as you like without having to pause for commercials.,Freedom
Native Americans are the original inhabitants of the land that now constitutes the United States. They have helped develop the fundamental principles of freedom of speech and separation of powers that form the foundation of the United States Government.,Freedom
"Fiction is such a world of freedom, it's wonderful. If you want someone to fly, they can fly.",Freedom
I definitely want to continue working in independent films - and big budget stuff as well - but there's a freedom you have when you're not getting paid. It's easier to say no and there's no pressure to please the powers that be. Also I don't have to hear 'flirt and smile more.',Freedom
"We must remember both the sacrifices and service of the Greatest Generation who secured freedom and prosperity for our world, as well as the horrors and lessons of the Holocaust.",Freedom
"The progress of freedom depends more upon the maintenance of peace, the spread of commerce, and the diffusion of education, than upon the labors of cabinets and foreign offices.",Freedom
"The post-presidency, as Jimmy Carter and Bill Clinton have proved, is a win-win. Money, Nobels, the ability to leverage your global celebrity for any cause or hobbyhorse you wish, plus freedom to grab the mike whenever the urge takes you without any terminal repercussions.",Freedom
Freedom is the emancipation from the arbitrary rule of other men.,Freedom
