Man will never be free until the last king is strangled with the entrails of the last priest.,Freedom
"May we think of freedom, not as the right to do as we please, but as the opportunity to do what is right.",Freedom
"It does not take a majority to prevail... but rather an irate, tireless minority, keen on setting brushfires of freedom in the minds of men.",Freedom
"Freedom consists not in doing what we like, but in having the right to do what we ought.",Freedom
"Freedom is never more than one generation away from extinction. We didn't pass it to our children in the bloodstream. It must be fought for, protected, and handed on for them to do the same.",Freedom
The only way to deal with an unfree world is to become so absolutely free that your very existence is an act of rebellion.,Freedom
"When we lose the right to be different, we lose the privilege to be free.",Freedom
Freedom is the oxygen of the soul.,Freedom
"We hold these truths to be self-evident: that all men are created equal; that they are endowed by their Creator with certain unalienable rights; that among these are life, liberty, and the pursuit of happiness.",Freedom
It is difficult to free fools from the chains they revere.,Freedom
None are more hopelessly enslaved than those who falsely believe they are free.,Freedom
"We will not waver; we will not tire; we will not falter, and we will not fail. Peace and Freedom will prevail.",Freedom
'Emergencies' have always been the pretext on which the safeguards of individual liberty have been eroded.,Freedom
Between stimulus and response there is a space. In that space is our power to choose our response. In our response lies our growth and our freedom.,Freedom
A hero is someone who understands the responsibility that comes with his freedom.,Freedom
I hope for nothing. I fear nothing. I am free.,Freedom
"If the freedom of speech is taken away then dumb and silent we may be led, like sheep to the slaughter.",Freedom
Freedom is what you do with what's been done to you.,Freedom
"We are driven by five genetic needs: survival, love and belonging, power, freedom, and fun.",Freedom
"There are two freedoms - the false, where a man is free to do what he likes; the true, where he is free to do what he ought.",Freedom
The work of art is a scream of freedom.,Freedom
"Freedom itself was attacked this morning by a faceless coward, and freedom will be defended.",Freedom
Freedom is never given; it is won.,Freedom
"There is no easy walk to freedom anywhere, and many of us will have to pass through the valley of the shadow of death again and again before we reach the mountaintop of our desires.",Freedom
"For to be free is not merely to cast off one's chains, but to live in a way that respects and enhances the freedom of others.",Freedom
"I am free because I know that I alone am morally responsible for everything I do. I am free, no matter what rules surround me. If I find them tolerable, I tolerate them; if I find them too obnoxious, I break them. I am free because I know that I alone am morally responsible for everything I do.",Freedom
"The most important kind of freedom is to be what you really are. You trade in your reality for a role. You give up your ability to feel, and in exchange, put on a mask.",Freedom
"Guard with jealous attention the public liberty. Suspect everyone who approaches that jewel. Unfortunately, nothing will preserve it but downright force. Whenever you give up that force, you are inevitably ruined.",Freedom
Humanity has won its battle. Liberty now has a country.,Freedom
"What is freedom of expression? Without the freedom to offend, it ceases to exist.",Freedom
"Those who expect to reap the blessings of freedom must, like men, undergo the fatigue of supporting it.",Freedom
I would like to be remembered as a person who wanted to be free... so other people would be also free.,Freedom
Freedom is nothing but a chance to be better.,Freedom
Freedom is something that dies unless it's used.,Freedom
The right to be let alone is indeed the beginning of all freedoms.,Freedom
Freedom is the recognition of necessity.,Freedom
"If you want total security, go to prison. There you're fed, clothed, given medical care and so on. The only thing lacking... is freedom.",Freedom
Freedom is the right to tell people what they do not want to hear.,Freedom
People demand freedom of speech as a compensation for the freedom of thought which they seldom use.,Freedom
"Those who deny freedom to others deserve it not for themselves; and under the rule of a just God, cannot long retain it.",Freedom
"Liberty is not the power of doing what we like, but the right to do what we ought.",Freedom
"Expose yourself to your deepest fear; after that, fear has no power, and the fear of freedom shrinks and vanishes. You are free.",Freedom
Freedom and justice cannot be parceled out in pieces to suit political convenience. I don't believe you can stand for freedom for one group of people and deny it to others.,Freedom
"Freedom makes a huge requirement of every human being. With freedom comes responsibility. For the person who is unwilling to grow up, the person who does not want to carry his own weight, this is a frightening prospect.",Freedom
Freedom is never voluntarily given by the oppressor; it must be demanded by the oppressed.,Freedom
"What is ominous is the ease with which some people go from saying that they don't like something to saying that the government should forbid it. When you go down that road, don't expect freedom to survive very long.",Freedom
"There is no such thing as a little freedom. Either you are all free, or you are not free.",Freedom
Freedom means the opportunity to be what we never thought we would be.,Freedom
"Emancipate yourselves from mental slavery, none but ourselves can free our minds!",Freedom
Freedom lies in being bold.,Freedom
Man is free at the moment he wishes to be.,Freedom
Freedom is the sure possession of those alone who have the courage to defend it.,Freedom
Necessity is blind until it becomes conscious. Freedom is the consciousness of necessity.,Freedom
"The liberties of a people never were, nor ever will be, secure, when the transactions of their rulers may be concealed from them.",Freedom
"At what point then is the approach of danger to be expected? I answer, if it ever reach us, it must spring up amongst us. It cannot come from abroad. If destruction be our lot, we must ourselves be its author and finisher. As a nation of freemen, we must live through all time, or die by suicide.",Freedom
"The more decisions that you are forced to make alone, the more you are aware of your freedom to choose.",Freedom
Conformity is the jailer of freedom and the enemy of growth.,Freedom
"I'm a big advocate of freedom: freedom of speech, freedom of expression, freedom of thought.",Freedom
Responsibility is the price of freedom.,Freedom
It is harder to preserve than to obtain liberty.,Freedom
Liberty means responsibility. That is why most men dread it.,Freedom
"Free people, remember this maxim: we may acquire liberty, but it is never recovered if it is once lost.",Freedom
"We hold our heads high, despite the price we have paid, because freedom is priceless.",Freedom
Seek freedom and become captive of your desires. Seek discipline and find your liberty.,Freedom
The desire of gold is not for gold. It is for the means of freedom and benefit.,Freedom
Our freedom can be measured by the number of things we can walk away from.,Freedom
True individual freedom cannot exist without economic security and independence. People who are hungry and out of a job are the stuff of which dictatorships are made.,Freedom
"What light is to the eyes - what air is to the lungs - what love is to the heart, liberty is to the soul of man.",Freedom
Liberty cannot be preserved without general knowledge among the people.,Freedom
"I believe in freedom of speech, but I believe we should also have the right to comment on freedom of speech.",Freedom
"I am not an Athenian or a Greek, but a citizen of the world.",Freedom
Real freedom is having nothing. I was freer when I didn't have a cent.,Freedom
The truth is I love being alive. And I love feeling free. So if I can't have those things then I feel like a caged animal and I'd rather not be in a cage. I'd rather be dead. And it's real simple. And I think it's not that uncommon.,Freedom
Let freedom reign. The sun never set on so glorious a human achievement.,Freedom
Freedom means you are unobstructed in living your life as you choose. Anything less is a form of slavery.,Freedom
Do not allow to slip away from you freedoms the people who came before you won with such hard knocks.,Freedom
"I need this wild life, this freedom.",Freedom
Freedom is contagious. That's why despots fear it so much.,Freedom
"Liberty, when it begins to take root, is a plant of rapid growth.",Freedom
"Liberty has never come from Government. Liberty has always come from the subjects of it. The history of liberty is a history of limitations of governmental power, not the increase of it.",Freedom
"The only freedom which deserves the name is that of pursuing our own good, in our own way, so long as we do not attempt to deprive others of theirs, or impede their efforts to obtain it.",Freedom
"In America, through pressure of conformity, there is freedom of choice, but nothing to choose from.",Freedom
The boisterous sea of liberty is never without a wave.,Freedom
Enslave the liberty of but one human being and the liberties of the world are put in peril.,Freedom
Order without liberty and liberty without order are equally destructive.,Freedom
We must be willing to pay a price for freedom.,Freedom
A hungry man is not a free man.,Freedom
You have freedom when you're easy in your harness.,Freedom
"Any people anywhere, being inclined and having the power, have the right to rise up, and shake off the existing government, and form a new one that suits them better. This is a most valuable - a most sacred right - a right, which we hope and believe, is to liberate the world.",Freedom
Freedom is man's capacity to take a hand in his own development. It is our capacity to mold ourselves.,Freedom
You can have peace. Or you can have freedom. Don't ever count on having both at once.,Freedom
Man is not free unless government is limited.,Freedom
I only ask to be free. The butterflies are free.,Freedom
Anxiety is the dizziness of freedom.,Freedom
"A new breeze is blowing, and a world refreshed by freedom seems reborn; for in man's heart, if not in fact, the day of the dictator is over. The totalitarian era is passing, its old ideas blown away like leaves from an ancient, lifeless tree.",Freedom
'Freedom from fear' could be said to sum up the whole philosophy of human rights.,Freedom
No man is good enough to be another's master.,Freedom
"For in the end, freedom is a personal and lonely battle; and one faces down fears of today so that those of tomorrow might be engaged.",Freedom
Free speech carries with it some freedom to listen.,Freedom
Freedom granted only when it is known beforehand that its effects will be beneficial is not freedom.,Freedom
"Civilization is the progress toward a society of privacy. The savage's whole existence is public, ruled by the laws of his tribe. Civilization is the process of setting man free from men.",Freedom
I wish that every human life might be pure transparent freedom.,Freedom
"It is a universal truth that the loss of liberty at home is to be charged to the provisions against danger, real or pretended, from abroad.",Freedom
"But what is liberty without wisdom, and without virtue? It is the greatest of all possible evils; for it is folly, vice, and madness, without tuition or restraint.",Freedom
You can only protect your liberties in this world by protecting the other man's freedom.,Freedom
"As human beings, we are endowed with freedom of choice, and we cannot shuffle off our responsibility upon the shoulders of God or nature. We must shoulder it ourselves. It is our responsibility.",Freedom
Liberty must be limited in order to be possessed.,Freedom
Freedom prospers when religion is vibrant and the rule of law under God is acknowledged.,Freedom
"Whether in chains or in laurels, liberty knows nothing but victories.",Freedom
"When freedom does not have a purpose, when it does not wish to know anything about the rule of law engraved in the hearts of men and women, when it does not listen to the voice of conscience, it turns against humanity and society.",Freedom
There is danger from all men. The only maxim of a free government ought to be to trust no man living with power to endanger the public liberty.,Freedom
You can only be free if I am free.,Freedom
Perhaps the fact that we have seen millions voting themselves into complete dependence on a tyrant has made our generation understand that to choose one's government is not necessarily to secure freedom.,Freedom
Freedom is from within.,Freedom
Freedom rings where opinions clash.,Freedom
"It is by the goodness of God that in our country we have those three unspeakably precious things: freedom of speech, freedom of conscience, and the prudence never to practice either of them.",Freedom
Freedom is not worth having if it does not connote freedom to err.,Freedom
Freedom is the only law which genius knows.,Freedom
Freedom of the press is not an end in itself but a means to the end of achieving a free society.,Freedom
Liberty is worth paying for.,Freedom
Freedom is the right to one's dignity as a man.,Freedom
I think I have a right to live my life the way I like.,Freedom
Freedom is not enough.,Freedom
Is freedom anything else than the right to live as we wish? Nothing else.,Freedom
"I believe firmly that in making ethical decisions, man has the prerogative of true freedom of choice.",Freedom
Liberty is not a means to a higher political end. It is itself the highest political end.,Freedom
Heresy is another word for freedom of thought.,Freedom
None who have always been free can understand the terrible fascinating power of the hope of freedom to those who are not free.,Freedom
"All free men, wherever they may live, are citizens of Berlin. And therefore, as a free man, I take pride in the words 'Ich bin ein Berliner!'",Freedom
Perfect freedom is as necessary to the health and vigor of commerce as it is to the health and vigor of citizenship.,Freedom
Freedom of opinion can only exist when the government thinks itself secure.,Freedom
"I am just absolutely convinced that the best formula for giving us peace and preserving the American way of life is freedom, limited government, and minding our own business overseas.",Freedom
"Freedom is a man's natural power of doing what he pleases, so far as he is not prevented by force or law.",Freedom
"The only sure bulwark of continuing liberty is a government strong enough to protect the interests of the people, and a people strong enough and well enough informed to maintain its sovereign control over the goverment.",Freedom
"We're giving our freedoms away. The American experiment was about freedom. Freedom to be stupid, freedom to fail, freedom to succeed.",Freedom
All theory is against freedom of the will; all experience for it.,Freedom
"My father always said, 'Malala will be free as a bird.'",Freedom
"As long as men are free to ask what they must, free to say what they think, free to think what they will, freedom can never be lost and science can never regress.",Freedom
"Coercion, after all, merely captures man. Freedom captivates him.",Freedom
Freedom - an occupied space which must be reoccupied every day.,Freedom
You cannot parcel out freedom in pieces because freedom is all or nothing.,Freedom
"I chose America as my home because I value freedom and democracy, civil liberties and an open society.",Freedom
The revelation of thought takes men out of servitude into freedom.,Freedom
The more liberty you give away the more you will have.,Freedom
No nation could preserve its freedom in the midst of continual warfare.,Freedom
Liberation is not deliverance.,Freedom
Freedom is absolutely necessary for the progress in science and the liberal arts.,Freedom
I believe we are on an irreversible trend toward more freedom and democracy - but that could change.,Freedom
Human beings crave freedom at their core.,Freedom
"We do not commonly see in a tax a diminution of freedom, and yet it clearly is one.",Freedom
Freedom is not worth fighting for if it means no more than license for everyone to get as much as he can for himself.,Freedom
The liberty of the individual is a necessary postulate of human progress.,Freedom
"But it wasn't until I graduated from Texas A & M University and joined the United States Air Force, flying C-130's all around the globe, that I truly appreciated the blessings of freedom.",Freedom
"Every man must have the right fearlessly to think independently and express his opinion about what he knows, what he has personally thought about and experienced, and not merely to express with slightly different variations the opinion which has been inculcated in him.",Freedom
To be able to love and live in freedom means to be able to make godly decisions. To make godly decisions we have to surrender our egos and all the falsity and shame that goes with it.,Freedom
One of the unsung freedoms that go with a free press is the freedom not to read it.,Freedom
"The momentum of freedom in our world is unmistakable - and it is not carried forward by our power alone. We can trust in that greater power Who guides the unfolding of the years. And in all that is to come, we can know that His purposes are just and true.",Freedom
Free men are the strongest men.,Freedom
"If you're not ready to die for it, put the word 'freedom' out of your vocabulary.",Freedom
"Freedom is never easily won, but once established, freedom lasts, spreads and chokes out tyranny.",Freedom
We should favor innovation and freedom over regulation.,Freedom
The link between my experience as an entrepreneur and that of a politician is all in one word: freedom.,Freedom
The very idea of freedom incites fear in the hearts of terrorists across the world.,Freedom
"Love myself I do. Not everything, but I love the good as well as the bad. I love my crazy lifestyle, and I love my hard discipline. I love my freedom of speech and the way my eyes get dark when I'm tired. I love that I have learned to trust people with my heart, even if it will get broken. I am proud of everything that I am and will become.",Freedom
"Today I choose life. Every morning when I wake up I can choose joy, happiness, negativity, pain... To feel the freedom that comes from being able to continue to make mistakes and choices - today I choose to feel life, not to deny my humanity but embrace it.",Freedom
"Just living is not enough... one must have sunshine, freedom, and a little flower.",Freedom
The secret to happiness is freedom... And the secret to freedom is courage.,Freedom
"I've learned that fear limits you and your vision. It serves as blinders to what may be just a few steps down the road for you. The journey is valuable, but believing in your talents, your abilities, and your self-worth can empower you to walk down an even brighter path. Transforming fear into freedom - how great is that?",Freedom
"If we don't believe in freedom of expression for people we despise, we don't believe in it at all.",Freedom
"I believe our flag is more than just cloth and ink. It is a universally recognized symbol that stands for liberty, and freedom. It is the history of our nation, and it's marked by the blood of those who died defending it.",Freedom
"Once your mind and body is healthy, it creates a freedom that helps you enjoy life.",Freedom
Freedom of speech is a human right and the foundation upon which democracy is built. Any restriction of freedom of speech is a restriction upon democracy.,Freedom
"The more you practice, the better you get, the more freedom you have to create.",Freedom
"Every human has four endowments - self awareness, conscience, independent will and creative imagination. These give us the ultimate human freedom... The power to choose, to respond, to change.",Freedom
I took up arms for the freedom of my color. It is our own - we will defend it or perish.,Freedom
"Freedom does not come without a price. We may sometimes take for granted the many liberties we enjoy in America, but they have all been earned through the ultimate sacrifice paid by so many of the members of our armed forces.",Freedom
"Real freedom lies in wildness, not in civilization.",Freedom
"Most people do not really want freedom, because freedom involves responsibility, and most people are frightened of responsibility.",Freedom
"Your life is the sum result of all the choices you make, both consciously and unconsciously. If you can control the process of choosing, you can take control of all aspects of your life. You can find the freedom that comes from being in charge of yourself.",Freedom
"We don't appreciate what we have until it's gone. Freedom is like that. It's like air. When you have it, you don't notice it.",Freedom
"137 years later, Memorial Day remains one of America's most cherished patriotic observances. The spirit of this day has not changed - it remains a day to honor those who died defending our freedom and democracy.",Freedom
"I think this society suffers so much from too much freedom, too many rights that allow people to be irresponsible.",Freedom
"The secret of freedom lies in educating people, whereas the secret of tyranny is in keeping them ignorant.",Freedom
"I am an optimist, and I believe that people are inherently good and that if you give everyone a voice and freedom of expression, the truth and the good will outweigh the bad.",Freedom
Children should have enough freedom to be themselves - once they've learned the rules.,Freedom
"I come bearing an olive branch in one hand, and the freedom fighter's gun in the other. Do not let the olive branch fall from my hand.",Freedom
"We, the People, recognize that we have responsibilities as well as rights; that our destinies are bound together; that a freedom which only asks what's in it for me, a freedom without a commitment to others, a freedom without love or charity or duty or patriotism, is unworthy of our founding ideals, and those who died in their defense.",Freedom
"The end of law is not to abolish or restrain, but to preserve and enlarge freedom. For in all the states of created beings capable of law, where there is no law, there is no freedom.",Freedom
"I'll tell you what freedom is to me: no fear. I mean really, no fear!",Freedom
For us democracy is a question of human dignity. And human dignity is political freedom.,Freedom
"Art, freedom and creativity will change society faster than politics.",Freedom
Ultimately we know deeply that the other side of every fear is freedom.,Freedom
True independence and freedom can only exist in doing what's right.,Freedom
"Freedom isn't free. It shouldn't be a bragging point that 'Oh, I don't get involved in politics,' as if that makes someone cleaner. No, that makes you derelict of duty in a republic. Liars and panderers in government would have a much harder time of it if so many people didn't insist on their right to remain ignorant and blindly agreeable.",Freedom
Freedom is the open window through which pours the sunlight of the human spirit and human dignity.,Freedom
"In a completely sane world, madness is the only freedom.",Freedom
Freedom's just another word for nothing left to lose.,Freedom
Nothing changes the gender equation more significantly than women's economic freedom.,Freedom
"On a motorcycle, you can't really think about more than where you are. There's a freedom that comes with that - from stress, worry, sweating the small stuff.",Freedom
"It is cruel, you know, that music should be so beautiful. It has the beauty of loneliness of pain: of strength and freedom. The beauty of disappointment and never-satisfied love. The cruel beauty of nature and everlasting beauty of monotony.",Freedom
War is peace. Freedom is slavery. Ignorance is strength.,Freedom
"Struggle is a never ending process. Freedom is never really won, you earn it and win it in every generation.",Freedom
Freedom of speech should be wide open as long as it doesn't incite violence.,Freedom
"Be strong, believe in freedom and in God, love yourself, understand your sexuality, have a sense of humor, masturbate, don't judge people by their religion, color or sexual habits, love life and your family.",Freedom
Freedom and democracy are dreams you never give up.,Freedom
The greatest threat to freedom is the absence of criticism.,Freedom
"Hatred is corrosive of a person's wisdom and conscience; the mentality of enmity can poison a nation's spirit, instigate brutal life and death struggles, destroy a society's tolerance and humanity, and block a nation's progress to freedom and democracy.",Freedom
I am confident that if we stand for the hope and freedom of others we will make our own freedom more secure.,Freedom
"Pakistan not only means freedom and independence but the Muslim Ideology which has to be preserved, which has come to us as a precious gift and treasure and which, we hope other will share with us.",Freedom
"True success, true happiness lies in freedom and fulfillment.",Freedom
"To know yourself as the Being underneath the thinker, the stillness underneath the mental noise, the love and joy underneath the pain, is freedom, salvation, enlightenment.",Freedom
Financial freedom is available to those who learn about it and work for it.,Freedom
