"That though the radiance which was once so bright be now forever taken from my sight. Though nothing can bring back the hour of splendor in the grass, glory in the flower. We will grieve not, rather find strength in what remains behind.",Sympathy
Death is not the greatest loss in life. The greatest loss is what dies inside us while we live.,Sympathy
Grief is the price we pay for love.,Sympathy
"Unable are the loved to die, for love is immortality.",Sympathy
"Here bring your wounded hearts, here tell your anguish; Earth has no sorrow that Heaven cannot heal.",Sympathy
"Grief changes shape, but it never ends.",Sympathy
"The purpose of human life is to serve, and to show compassion and the will to help others.",Sympathy
Life has never been easy. Nor is it meant to be. It is a matter of being joyous in the face of sorrow.,Sympathy
"Loss and possession, death and life are one, There falls no shadow where there shines no sun.",Sympathy
There is no pain so great as the memory of joy in present grief.,Sympathy
It's sad when someone you know becomes someone you knew.,Sympathy
"One's life has value so long as one attributes value to the life of others, by means of love, friendship, indignation and compassion.",Sympathy
"No matter how prepared you think you are for the death of a loved one, it still comes as a shock, and it still hurts very deeply.",Sympathy
Worry does not empty tomorrow of its sorrow. It empties today of its strength.,Sympathy
There is no greater sorrow than to recall happiness in times of misery.,Sympathy
"The loss of a friend is like that of a limb; time may heal the anguish of the wound, but the loss cannot be repaired.",Sympathy
"When sorrows come, they come not single spies, but in battalions.",Sympathy
"Sorrow can be alleviated by good sleep, a bath and a glass of wine.",Sympathy
"What is lovely never dies, But passes into other loveliness.",Sympathy
What does love look like? It has the hands to help others. It has the feet to hasten to the poor and needy. It has eyes to see misery and want. It has the ears to hear the sighs and sorrows of men. That is what love looks like.,Sympathy
"Truly, it is in darkness that one finds the light, so when we are in sorrow, then this light is nearest of all to us.",Sympathy
"Excess of grief for the dead is madness; for it is an injury to the living, and the dead know it not.",Sympathy
The only cure for grief is action.,Sympathy
Flowers grow out of dark moments.,Sympathy
I am not interested in picking up crumbs of compassion thrown from the table of someone who considers himself my master. I want the full menu of rights.,Sympathy
"Happiness is beneficial for the body, but it is grief that develops the powers of the mind.",Sympathy
"When you lose a person you love so much, surviving the loss is difficult.",Sympathy
Sorrow is a fruit. God does not make it grow on limbs too weak to bear it.,Sympathy
There is no grief like the grief that does not speak.,Sympathy
Grief is a normal and natural response to loss. It is originally an unlearned feeling process. Keeping grief inside increases your pain.,Sympathy
I think loss of loved ones is the hardest blow in life.,Sympathy
Sorrow is so easy to express and yet so hard to tell.,Sympathy
Any mind that is capable of real sorrow is capable of good.,Sympathy
The dew of compassion is a tear.,Sympathy
Tears are the silent language of grief.,Sympathy
Grief can't be shared. Everyone carries it alone. His own burden in his own way.,Sympathy
"You don't go around grieving all the time, but the grief is still there and always will be.",Sympathy
"Let no one weep for me, or celebrate my funeral with mourning; for I still live, as I pass to and fro through the mouths of men.",Sympathy
Almost all of our sorrows spring out of our relations with other people.,Sympathy
Bear and endure: This sorrow will one day prove to be for your good.,Sympathy
Excessive sorrow laughs. Excessive joy weeps.,Sympathy
From the end spring new beginnings.,Sympathy
Only by joy and sorrow does a person know anything about themselves and their destiny. They learn what to do and what to avoid.,Sympathy
"If we wait until our lives are free from sorrow or difficulty, then we wait forever. And miss the entire point.",Sympathy
To desire and expect nothing for oneself and to have profound sympathy for others is genuine holiness.,Sympathy
A sorrow's crown of sorrow is remembering happier times.,Sympathy
"It is a great consolation for me to remember that the Lord, to whom I had drawn near in humble and child-like faith, has suffered and died for me, and that He will look on me in love and compassion.",Sympathy
Developing our sympathetic compassion is not only possible but the only reason for us to be here on earth.,Sympathy
"Our trials, our sorrows, and our grieves develop us.",Sympathy
"If you suppress grief too much, it can well redouble.",Sympathy
"When you are sorrowful look again in your heart, and you shall see that in truth you are weeping for that which has been your delight.",Sympathy
"Come away, O human child: To the waters and the wild with a fairy, hand in hand, For the world's more full of weeping than you can understand.",Sympathy
One often calms one's grief by recounting it.,Sympathy
Those who weep recover more quickly than those who smile.,Sympathy
"I say to people who care for people who are dying, if you really love that person and want to help them, be with them when their end comes close. Sit with them - you don't even have to talk. You don't have to do anything but really be there with them.",Sympathy
"Grieve and mourn for yourself not once or twice, but again and again.",Sympathy
People who drink to drown their sorrow should be told that sorrow knows how to swim.,Sympathy
The cure for sorrow is to learn something.,Sympathy
Sympathy is two hearts tugging at one load.,Sympathy
Grief knits two hearts in closer bonds than happiness ever can; and common sufferings are far stronger links than common joys.,Sympathy
A sympathetic friend can be quite as dear as a brother.,Sympathy
"The more sympathy you give, the less you need.",Sympathy
"It is foolish to tear one's hair in grief, as though sorrow would be made less by baldness.",Sympathy
Not without hope we suffer and we mourn.,Sympathy
The natural effect of sorrow over the dead is to refine and elevate the mind.,Sympathy
"We should feel sorrow, but not sink under its oppression.",Sympathy
"It is in our faults and failings, not in our virtues, that we touch each other, and find sympathy. It is in our follies that we are one.",Sympathy
"If there was less sympathy in the world, there would be less trouble in the world.",Sympathy
"I have sometimes been wildly, despairingly, acutely miserable, racked with sorrow, but through it all I still know quite certainly that just to be alive is a grand thing.",Sympathy
"What ye have been ye still shall be, When we are dust the dust among, O yellow flowers!",Sympathy
"If our hearts are ready for anything, we can open to our inevitable losses, and to the depths of our sorrow. We can grieve our lost loves, our lost youth, our lost health, our lost capacities. This is part of our humanness, part of the expression of our love for life.",Sympathy
"After you have wept and grieved for your physical losses, cherish the functions and the life you have left.",Sympathy
"I have nothing but sympathy for the people who are forced to work with me. I'm better now at picking out those that want to play that game with me, and those that don't.",Sympathy
"At a family's most difficult time, I want to make sure at a minimum that they have the very basic of comforts: the ability to grieve their loss privately and the knowledge that their country is grateful for their loved one's sacrifice and service.",Sympathy
"Sympathy is charming, but it does not make up for pain.",Sympathy
"Farewell, dearest friend, never to see one another any more till at the right hand of Christ.",Sympathy
"I believe that everyone can appreciate the right of a family to grieve the loss of a loved one in peace, regardless of anyone's position on the war in Iraq and Afghanistan.",Sympathy
Great grief does not of itself put an end to itself.,Sympathy
The heart forgets its sorrow and ache.,Sympathy
"I will indulge my sorrows, and give way to all the pangs and fury of despair.",Sympathy
"Pity may represent little more than the impersonal concern which prompts the mailing of a check, but true sympathy is the personal concern which demands the giving of one's soul.",Sympathy
"In any business, the more you learn, the more sympathetic you can be to other people's positions.",Sympathy
There is a joy in sorrow which none but a mourner can know.,Sympathy
Grief is only the memory of widowed affections.,Sympathy
"A crowd always thinks with its sympathy, never with its reason.",Sympathy
I was brought up to be sympathetic toward others.,Sympathy
"As Christians, our compassion is simply a response to the love that God has already shown us.",Sympathy
"Learning a foreign language, and the culture that goes with it, is one of the most useful things we can do to broaden the empathy and imaginative sympathy and cultural outlook of children.",Sympathy
"Both tears and sweat are salty, but they render a different result. Tears will get you sympathy; sweat will get you change.",Sympathy
You are 27 or 28 right? It is very tough to live at that age. When nothing is sure. I have sympathy with you.,Sympathy
"In Japanese culture, there is a belief that God is everywhere - in mountains, trees, rocks, even in our sympathy for robots or Hello Kitty toys.",Sympathy
"No one has yet realized the wealth of sympathy, the kindness and generosity hidden in the soul of a child. The effort of every true education should be to unlock that treasure.",Sympathy
"Two nations between whom there is no intercourse and no sympathy; who are as ignorant of each other's habits, thoughts, and feelings, as if they were dwellers in different zones, or inhabitants of different planets. The rich and the poor.",Sympathy
Women have no sympathy and my experience of women is almost as large as Europe.,Sympathy
Children require guidance and sympathy far more than instruction.,Sympathy
"Deliberately seek opportunities for kindness, sympathy, and patience.",Sympathy
"In grade one and two, I was definitely into heavy metal and Satanic rock music, bands that had attributes that were quote-unquote 'Satanic,' even things like the Rolling Stones with 'Their Satanic Majesties Request' and 'Sympathy for the Devil,' but also like Motley Crue and Kiss and Alice Cooper.",Sympathy
I never ask for mercy and seek no one's sympathy.,Sympathy
"In the early days of the Russian Revolution in 1917, I was completely in sympathy with it. I felt that it established a new era in the history of the modern world. I was so overwhelmed by it that, if people made any unfriendly comment, I would vigorously defend it. If people condemned the Communist party, I would speak in its defense.",Sympathy
"When you've been raised in care, rap music isn't just about guns and sexism. They're talking about real things you can hang on to, problems of identity that you have sympathy with. It's not just about the music, with rap: when I was in care, it meant a whole lot more than that.",Sympathy
"Neymar doesn't need to act - he's an excellent player, and he has everything a high-level player needs. He's one of the top five players in the world; why does he need to act? It doesn't bring him sympathy, and it's not good for him.",Sympathy
It is only after one is in trouble that one realizes how little sympathy and kindness there are in the world.,Sympathy
"I've always thought of acting as more of an exercise in empathy, which is not to be confused with sympathy. You're trying to get inside a certain emotional reality or motivational reality and try to figure out what that's about so you can represent it.",Sympathy
It appears to be a law that you cannot have a deep sympathy with both man and nature.,Sympathy
"In fiction, imaginary people become realer to us than any named celebrity glimpsed in a series of rumored events, whose causes and subtler ramifications must remain in the dark. An invented figure like Anna Karenina or Emma Bovary emerges fully into the light of understanding, which brings with it identification, sympathy and pity.",Sympathy
Autumn wins you best by this its mute appeal to sympathy for its decay.,Sympathy
Marriage must be a relation either of sympathy or of conquest.,Sympathy
"Unfair discrimination exists whether we like it or not; I wouldn't have married a gum-chewing vegetarian. Ultimately, we'll help the people we discriminate against if we try to understand more about them; genetics will lead to a world where there is a sympathy for the underdog.",Sympathy
"Pretty much all the drivers I get on with, at least to say 'Hi' and have a conversation. But when the helmet's on, you don't care who it is. You have no sympathy: someone blows an engine in front of you, if it means you gain a position, then you're smiling.",Sympathy
To all those who have suffered as a consequence of our troubled past I extend my sincere thoughts and deep sympathy. With the benefit of historical hindsight we can all see things which we would wish had been done differently or not at all.,Sympathy
"The rule of friendship means there should be mutual sympathy between them, each supplying what the other lacks and trying to benefit the other, always using friendly and sincere words.",Sympathy
"Captain Hale, alone, without sympathy or support, save that from above, on the near approach of death asked for a clergyman to attend him. It was refused. He then requested a Bible; that too was refused by his inhuman jailer.",Sympathy
The community stagnates without the impulse of the individual. The impulse dies away without the sympathy of the community.,Sympathy
"'Ninnu Kori' urges us to take a broader view of life, look past stumbling blocks, and rise above self sympathy.",Sympathy
"Kindliness and sympathy, fellowship and understanding, are always good, but best when they come from a distant corner of the world.",Sympathy
Sympathy is the first condition of criticism.,Sympathy
We must not permit our respect for the dead or our sympathy for the living to lead us into an act of injustice to the balance of the living.,Sympathy
I would rather be kept alive in the efficient if cold altruism of a large hospital than expire in a gush of warm sympathy in a small one.,Sympathy
And whoever walks a furlong without sympathy walks to his own funeral drest in his shroud.,Sympathy
"Men we shall have only as we make manhood the object of the work of the schools - intelligence, broad sympathy, knowledge of the world that was and is, and of the relation of men to it - this is the curriculum of that Higher Education which must underlie true life.",Sympathy
"Badges mean nothing in themselves, but they mark a certain achievement and they are a link between the rich and the poor. For when one girl sees a badge on a sister Scout's arm, if that girl has won the same badge, it at once awakens an interest and sympathy between them.",Sympathy
"True Scouts are the best friends of animals, for from living in the woods and wilds, and practising observation and tracking, they get to know more than other people about the ways and habits of birds and animals, and therefore they understand them and are more in sympathy with them.",Sympathy
"I am a believer in the evolutionary process, and yet I have sympathy for the friends of mine who are creationists. I don't find the positions incompatible.",Sympathy
"Any other illness, any other disease that we're faced with, there's sympathy and understanding. We get help for those. With mental illness, our go-to is to categorize them as, 'Oh, they're crazy,' to belittle the problem.",Sympathy
Men are often biased in their judgment on account of their sympathy and their interests.,Sympathy
It was no easy feat becoming Dominick Dunne. Think about it. He was the most celebrated chronicler of downtrodden socialites. He feasted on their famine with little sympathy or admiration for their formerly exalted positions. Yet somehow they invited him back.,Sympathy
"I learnt pity, sympathy, and what it was like to be at the other end of the stick. Such lessons can't be learnt in lecture halls.",Sympathy
"If I'm feeling outraged, grief, disbelief, frustration, sympathy, that gets channeled through me and into my pictures and hopefully transmitted to the viewer.",Sympathy
"Any relations in a social order will endure, if there is infused into them some of that spirit of human sympathy which qualifies life for immortality.",Sympathy
"Too often, we get attention and sympathy by being a victim. If we're invested in someone being our villain, we must love being the victim. We have to let go of both characters in the story.",Sympathy
"The knowledge that we have brother scouts working in the same uniform, to the same ends, in the same way, in all corners of the Empire, cannot but make scouts proud of their brotherhood, and cannot fail to bring them into closer sympathy.",Sympathy
"Character is made of duty and love and sympathy, and, above all, of living and working for others.",Sympathy
"I have every sympathy for writers. It's a mystery to me what they do. I can edit. I can cross out and say, 'I'm not saying that' or, 'How about we move this to here? Wouldn't that make that bit of the story better?' But where any of it comes from is beyond me. I will never write a play or a novel.",Sympathy
My impressions of the Russian Revolution can be divided into two periods. The first period was when I showed deep sympathy. My second period is one of disappointment. This change was the result of close observation on the spot.,Sympathy
"Sympathy constitutes friendship; but in love there is a sort of antipathy, or opposing passion. Each strives to be the other, and both together make up one whole.",Sympathy
All sympathy not consistent with acknowledged virtue is but disguised selfishness.,Sympathy
"Authors are not a special case, deserving of more sympathy than many other groups. We are a particular case of a general degradation of the quality of life, and we are not going to stop pointing it out, because we speak for many other groups as well.",Sympathy
Motherhood is at its best when the tender chords of sympathy have been touched.,Sympathy
"A person who has sympathy for mankind in the lump, faith in its future progress, and desire to serve the great cause of this progress, should be called not a humanist, but a humanitarian, and his creed may be designated as humanitarianism.",Sympathy
"Women are about the best lovers of nature, after all; at least of nature in her milder and more familiar forms. The feminine character, the feminine perceptions, intuitions, delicacy, sympathy, quickness, are more responsive to natural forms and influences than is the masculine mind.",Sympathy
I didn't go to university. Didn't even finish A-levels. But I have sympathy for those who did.,Sympathy
"In documentary filmmaking, there's a tradition of telling stories about victims. We often do that from a very patronizing place, but mostly we do it from a very selfish place, to reassure ourselves that our lives are in sympathy and solidarity with the victims.",Sympathy
"There is something terribly morbid in the modern sympathy with pain. One should sympathise with the colour, the beauty, the joy of life. The less said about life's sores the better.",Sympathy
September 11th was a moment when America had the sympathy of the world.,Sympathy
Tribes don't need Congressmembers' sympathy. What tribes need is for us to properly exercise our duty.,Sympathy
"If the terrorists have the sympathy of people, it's much harder to find them. So we need people on our side, and that leads us to be responsible leaders of the world, show some concern with the problems.",Sympathy
"Moreover, Hispanics' sympathy for big government represents a cultural predilection as well as an economic one.",Sympathy
I feel sympathy for the working class lad. I've always championed about ticket prices and try to equate that to people's salaries.,Sympathy
"I have several close friends who are insomniacs. Over the years, I've heard their stories about being up in the middle of the night, completely awake. I see them yawn at 11 A.M. and know that, regardless of what they are doing, they'd probably rather be in bed sleeping. I've always had sympathy for them, but I've never really understood it.",Sympathy
"Our late Leader, Dr. Sun Yat-sen, with his universal sympathy for all oppressed and his profound understanding of Jesus' revolutionary spirit of love and sacrifice, carried on his revolutionary work for forty years and brought about at last the liberation of the Chinese people.",Sympathy
"Good characters don't believe they're bad. As long as you as an actor believe in them and try to understand them, it's not hard to have empathy and sympathy.",Sympathy
I like movies that make you semi fall in love with the villain so you have sympathy for him.,Sympathy
"My upbringing has given me sympathy for the idea of isolation and what it is to be a new person in the room, where everyone else has some amount of familiarity and comfort.",Sympathy
"Children, even infants, are capable of sympathy. But only after adolescence are we capable of compassion.",Sympathy
The true humanist maintains a just balance between sympathy and selection.,Sympathy
"The American people want something terse, forcible, picturesque, striking - something that will arrest their attention, enlist their sympathy, arouse their indignation, stimulate their imagination, convince their reason, awaken their conscience.",Sympathy
"Pierre Curie came to see me and showed a simple and sincere sympathy with my student life. Soon he caught the habit of speaking to me of his dream of an existence consecrated entirely to scientific research, and he asked me to share that life.",Sympathy
"If you want to devote yourself to the arts, you'd better do it strictly from passion, because there is zero guarantee that you'll get anywhere. The hardest thing is dealing with business people who have nothing to do with your art. They could care less that you're up at 4:30 in the morning writing a joke. Don't expect any sympathy from anybody.",Sympathy
"This circus that's advertised to show and furnish a little amusement for us heathens is owned by a woman, one whose pluck catches my sympathy every time.",Sympathy
"The professional must learn to be moved and touched emotionally, yet at the same time stand back objectively: I've seen a lot of damage done by tea and sympathy.",Sympathy
"Sympathy is one of the principles most widely rooted in our nature: we rejoice to see ourselves reflected in another; and, perversely enough, we sometimes have a secret pleasure in seeing the sin which dwells in ourselves existing under a deformed and monstrous aspect in another.",Sympathy
"When our bodies are sick and people extend their sympathy, bring us soup, offer up solutions. When our minds are sick, people tend to shy away from you, be afraid, or call you outright crazy. I'm fascinated by the way society and individuals view mental illness, and most of my shorts comment on that.",Sympathy
"When you're successful, people have no sympathy. Nobody wants to catch the tears of a millionaire.",Sympathy
You develop a sympathy for all human beings when you travel a lot.,Sympathy
"I tend to foster drama via bleakness. If I want the reader to feel sympathy for a character, I cleave the character in half, on his birthday. And then it starts raining. And he's made of sugar.",Sympathy
Sympathy is something that shouldn't be bestowed upon the Yankees. Apparently it angers them.,Sympathy
"Women ought to feel a peculiar sympathy in the colored man's wrong, for, like him, she has been accused of mental inferiority, and denied the privileges of a liberal education.",Sympathy
"There should be a sympathy with freedom, a desire to give it scope, founded not upon visionary ideas, but upon the long experience of many generations within the shores of this happy isle, that in freedom you lay the firmest foundations both of loyalty and order.",Sympathy
I have a strong sympathy for all women who have struggled and suffered.,Sympathy
I'm not looking for sympathy at all.,Sympathy
"I take people very seriously. People are all I take seriously, in fact. Therefore, I have nothing but sympathy for how people behave - and nothing but laughter to console them with.",Sympathy
Having a baby is a disaster for your career. I don't think there's any sympathy.,Sympathy
"I want the municipality to be a helping hand to the man with a desire of sympathy, to help the fallen when it is not in their power to help themselves.",Sympathy
I am the son of a small and far-away nation and the other laureates have all come from different countries from all over the world and we all were equally received here with signs of sympathy.,Sympathy
"As human beings, we all have reasons for our behavior. There may be people who have certain physiological issues that dictate why they make certain choices. On the whole, though, I think we're dictated by our structure, our past, our environment, our culture. So once you understand the patterns that shape a person, how can you not find sympathy?",Sympathy
"In Shakespeare, unique individuals repudiate the stereotypes demanded by the structure of the play: Shylock commands our sympathy, Barnardine refuses to be hanged. Individuals trump the category.",Sympathy
