"Obviously, Jay-Z is one of the greatest entertainers of the world today. Not only is he a remarkable rhetorical genius, he's also a man of deep sympathy and empathy for those who are lost and vulnerable, but especially under-educated youth of all cultures and stripes.",Sympathy
"One might expect that the families of murder victims would be showered with sympathy and support, embraced by their communities. But in reality they are far more likely to feel isolated, fearful, and ashamed, overwhelmed by grief and guilt, angry at the criminal-justice system, and shunned by their old friends.",Sympathy
I have to have a character worth caring about. I tend not to start writing books about people I don't have a lot of sympathy for because I'm just going to be with them too long.,Sympathy
"You can't have empathy for somebody that's gone through something you haven't - because, definitionally, you can't. But you can feel for them and have sympathy for them. And that's what this country needs to practice more. It's about realizing that you do come from a different place.",Sympathy
"We do not learn by inference and deduction and the application of mathematics to philosophy, but by direct intercourse and sympathy.",Sympathy
"I can't understand why someone wouldn't have a degree of sympathy for people that had to flee their country, travel to try and find their home somewhere, and nobody wants them. How could you not be a little bit sympathetic?",Sympathy
"I have sympathy for young people, for their growing pains, but I balk when these growing pains are pushed into the foreground, when you make these young people the only vehicles of life's wisdom.",Sympathy
"We all have to announce our full solidarity with the struggle of those seeking freedom and justice in Syria, and translate this sympathy into a clear political vision that supports a peaceful transition to a democratic system of rule that reflects the demands of the Syrian people for freedom.",Sympathy
Nobody in football wants to receive sympathy.,Sympathy
"It's no good being nice and young and naive. There's no good in that at all. You've got to do it all yourself, and you've gotta learn quick. And you can't look for sympathy either.",Sympathy
"Jamal Khashoggi was a Muslim Brotherhood operative, and so I don't really feel sympathy for him.",Sympathy
"I damaged my health during 'Les Mis,' which I didn't want to mention in case it seemed like I was courting sympathy.",Sympathy
Interest does not tie nations together; it sometimes separates them. But sympathy and understanding does unite them.,Sympathy
I'm in total sympathy with Dick Smith's sentiments; I only wish there were grounds for saying we Australians would never tolerate such appalling treatment of refugees being carried out in our name.,Sympathy
Staying married may have long-term benefits. You can elicit much more sympathy from friends over a bad marriage than you ever can from a good divorce.,Sympathy
"I think that Jamal Khashoggi was an enemy of the state, and I don't really think that it's appropriate for American media institutions to be, you know, trying to generate sympathy. He's not a hero.",Sympathy
Sometimes you look at footballers and think they're selfish or they don't bring a good image to society. But sometimes people underestimate footballers and their capacity to have a strong opinion and sympathy for others.,Sympathy
"When Oliver Stone and Woody Allen came forward to express sympathy for Mr. Weinstein, everybody rolled their eyes at them, too.",Sympathy
"I don't really distinguish between sympathy and honesty when I'm writing. The two go together - I'm interested in inhabiting my characters, seeing the world through their eyes.",Sympathy
I don't think it's an incredibly radical premise to try and have sympathy for someone who has made a mistake.,Sympathy
Our sympathy is cold to the relation of distant misery.,Sympathy
"When we are out of sympathy with the young, then I think our work in this world is over.",Sympathy
"Sonia Gandhi and her husband have always been persons I look at with a lot of respect. Of course, one of the reasons we look at India with a lot of sympathy and enthusiasm is Sonia Gandhi. Now she is Indian, not Italian, but she will always represent a myth for Italians.",Sympathy
"Ultimately, knowing God and reading the Word, it helps with patience with people, understanding, empathy and sympathy that they might not have that I have. If God gave it to me, why not exercise it?",Sympathy
"The Who on record were dynamic. Roger Daltrey's delivery allowed vulnerability without weakness; doubt and confusion, but no plea for sympathy.",Sympathy
"If men and women are to understand each other, to enter into each other's nature with mutual sympathy, and to become capable of genuine comradeship, the foundation must be laid in youth.",Sympathy
"It's not very interesting to establish sympathy for people who, on the surface, are instantly sympathetic. I guess I'm always attracted to people who, if their lives were headlines in a newspaper, you might not be very sympathetic about them.",Sympathy
I wasn't a person to cry or point fingers or find any sympathy.,Sympathy
"Sympathy relies on a common experience. If you're clumsy, you might have sympathy for others who tend to bump into things. Empathy, on the other hand, is the ability to understand another person's feelings even if you've never experienced them yourself.",Sympathy
"I have sympathy for the people in Syria, and I do think there should be a worldwide response, but we should act cautiously.",Sympathy
"What is the meaning of 'gossip?' Doesn't it originate with sympathy, an interest in one's neighbor, degenerating into idle curiosity and love of tattling? Which is worse, this habit, or keeping one's self so absorbed intellectually as to forget the sufferings and cares of others, to lose sympathy through having too much to think about?",Sympathy
"My mother listened to all the news from the camp during the strike. She said little, especially when my father or the men who worked for him were about I remember her instinctive and unhesitating sympathy for the miners.",Sympathy
"For reasons historic, aesthetic, and political, we Jews are most attuned to the anti-Semitism of the far Right - and we find the most sympathy among our progressive allies when these are our attackers.",Sympathy
"In order that people who suffer from depression seek treatment without a second thought, the stigmas must further fall until we reach a point in time when that person with leukemia and that person with depression both receive the same level of sympathy and the same level of rigorous treatment. Both people deserve it.",Sympathy
"I have a great deal of sympathy for reluctant readers because I was one. I would do anything to avoid reading. In my case, it wasn't until I was 13 and discovered the 'Lord of the Rings' that I learned to love reading.",Sympathy
"Jewish Americans weren't just integrated, like other ethnic and religious groups. They also attracted a particular sympathy and admiration, rooted in Holocaust remembrance, affection for Israel, and a distinctive pride in the scope of their success.",Sympathy
"As far as I'm concerned, I own my dogs as I own my body. My legs are with me when I take a shower, and I feel no shame. If I were to lose one, I'd grieve, and people would send sympathy cards, but it would be my condition that evoked the sympathy, not the fate of the leg. That's like losing a dog.",Sympathy
"I believe that we must reach our brother, never toning down our fundamental oppositions, but meeting him when he asks to be met, with a reason for the faith that is in us, as well as with a loving sympathy for them as brothers.",Sympathy
I felt bad when George Bush was booed. But only briefly. My sympathy for that man has a half-life of about four seconds.,Sympathy
There is a great deal of sympathy amongst workers for the Occupy Wall Street movement. We understand their frustration.,Sympathy
"I can hardly express in words my deep feeling and sympathy for them, knowing as I do, the many serious handicaps and obstacles that will confront them in almost every walk of life.",Sympathy
"I'm not going to give a courtesy gift to a person who's going to win, and I'm not going to give a sympathy gift to a person who's going to lose.",Sympathy
"IT is mere coincidence that Cooper was born in the year which produced The Power of Sympathy and that when he died Uncle Tom's Cabin was passing through its serial stage, and yet the limits of his life mark almost exactly the first great period of American fiction.",Sympathy
Since this war began our sympathy has gone out to all the suffering people who have been dragged into it. Further hundreds of millions have become involved since I spoke at Limerick fortnight ago.,Sympathy
Sympathy with nature is part of a good person's religion.,Sympathy
More negatives write than call. It's a cheap shot for me to go on the air with the critical letters or E-mail I get because the reaction of the listeners is always an instantaneous expression of sympathy for me and contempt for the poor critic.,Sympathy
There's no greater way to gain an audience's sympathy than by being unfortunate.,Sympathy
The humanitarian lays stress almost solely upon breadth of knowledge and sympathy.,Sympathy
"California must be all American or all Chinese. We are resolved that it shall be American, and are prepared to make it so. May we not rely upon your sympathy and assistance?",Sympathy
You have to take strength from the people that love you and the people that love Barbara and the huge number of expressions of sympathy and compassion and support. That has been extremely moving.,Sympathy
"I have a theory because I was being beaten up a lot by people outside of school, it was almost like if I could make myself sick enough they'd take sympathy on me.",Sympathy
"Although I'm Australian, I find myself much more in sympathy with the Austrian version!",Sympathy
I have a lot of sympathy for young people because I realize how disturbed I was. How would I deal with life in the future? What would I do for a living?,Sympathy
"Because I select my players from a feeling that comes to me when I am with them, a certain sympathy you might call it, or a vibration that exists between us that convinces me they are right.",Sympathy
It's hard for me to think of others because I'm not particularly in sympathy with the music of this century.,Sympathy
"According to your sympathy, you will take pleasure in your own happiness or in the happiness of other people; but it is always your own happiness you seek.",Sympathy
"There's a certain amount of sympathy here for the Bush administration's problem, which is they would like to get rid of Saddam Hussein and they would like to have the Kurds autonomous.",Sympathy
Recognition of belligerency as an expression of sympathy is all very well.,Sympathy
I joined the Party definitely in 1923 after having already been in sympathy with it before.,Sympathy
But what you could perhaps do with in these days is a word of most sincere sympathy. Your movement is carried internally by so strong a truth and necessity that victory in one form or another cannot elude you for long.,Sympathy
"My guitar was loud as hell, and I had no sympathy for anybody else.",Sympathy
Actors who are lovers in real life are often incapable if playing the part of lovers to an audience. It is equally true that sympathy between actors who are not lovers may create a temporary emotion that is perfectly sincere.,Sympathy
"Many of the artists who have represented Negro life have seen only the comic, ludicrous side of it, and have lacked sympathy with and appreciation for the warm big heart that dwells within such a rough exterior.",Sympathy
This sympathy is not translated into force against the British government because it is not like the anti- apartheid movement which had a high profile here and Mandela is a more engaging figure than Yasser Arafat.,Sympathy
It was only on sympathy wave had KCR won the elections in 2014 and became the chief minister.,Sympathy
"I have a certain sympathy with politicians having lived with one. I've seen how no matter how earnest or driven or energetic they are, it's still difficult to change things. I have been encouraged to go into politics, but I don't think I could make a contribution, it suits me better to be sniping from the sidelines.",Sympathy
"Empathy is much bigger than sympathy. When the character is empathised with, that means you have succeeded as an actor. So even if it's a villain, the audiences don't hate you... they understand why you have turned into a villain.",Sympathy
I try to photograph with love and sympathy.,Sympathy
"A lot of people who end up being horrible criminals when they are adults had very abusive childhoods. You can have sympathy for that child. It does not at all, under any circumstances, diminish their responsibility for what they do.",Sympathy
My faith tells me where to go and get started and what kind of sympathy to have for people once you get there.,Sympathy
"How would you deal with it if you're 9 years old, people are telling you, 'You suck,' and they don't give sympathy? They don't feel bad for you because of who your dad is.",Sympathy
"I had a horrifying experience but what the world fails to understand is that the handicapped need no sympathy, they need to be encouraged in whatever they do.",Sympathy
"I'm not looking for sympathy. If there's other footballers addicted to gambling, then maybe me speaking about my battle might help them.",Sympathy
"People do get hurt by jellyfish, as they do by sharks and spiders, and I have great sympathy for the anguish and pain these effects may cause, but if you pay any attention to the statistics it is clear that nature is not out to get us.",Sympathy
